{
  "$schema": "http://json-schema.org/draft-07/schema#",
  "title": "GitHub Profile Card & Jet Heatmap Configuration",
  "description": "Single configuration file to customize all details of your GitHub profile README cards and animated jet heatmap.",
  "type": "object",
  "required": ["username", "name"],
  "properties": {
    "username": {
      "type": "string",
      "description": "Your GitHub username (used to fetch live contributions and profile picture)."
    },
    "name": {
      "type": "string",
      "description": "Your display name / subject name shown on the terminal card."
    },
    "commandTitle": {
      "type": "string",
      "description": "Shell prompt command shown in the terminal title bar (e.g. somya@codes ~ % ./profile.sh --live)."
    },
    "role": {
      "type": "string",
      "description": "Your primary title or role (e.g. AI/ML Engineer · Full Stack)."
    },
    "education": {
      "type": "string",
      "description": "Your education or major (e.g. CSE (AIML))."
    },
    "status": {
      "type": "string",
      "description": "Your current status or focus (e.g. Building · Learning · Shipping)."
    },
    "avatar": {
      "type": "object",
      "properties": {
        "auto": {
          "type": "boolean",
          "default": true,
          "description": "Automatically fetch your GitHub profile picture."
        },
        "url": {
          "type": "string",
          "description": "Custom avatar image URL (optional, overrides auto fetch if provided)."
        },
        "borderGlow": {
          "type": "string",
          "description": "Hex color for the avatar HUD glowing border (e.g. #22C55E)."
        },
        "badgeText": {
          "type": "string",
          "description": "Status badge label under avatar (e.g. PILOT // ONLINE)."
        }
      }
    },
    "skills": {
      "type": "object",
      "additionalProperties": {
        "type": "string"
      },
      "description": "Key-value map of your skills, tech stack, and toolchains."
    },
    "contacts": {
      "type": "object",
      "additionalProperties": {
        "type": "string"
      },
      "description": "Key-value map of your contact info, social handles, or portfolio links."
    },
    "heatmap": {
      "type": "object",
      "properties": {
        "title": {
          "type": "string",
          "description": "Footer label for the jet heatmap defense grid."
        }
      }
    }
  }
}
