{
  "$schema": "./profile.schema.json",
  "username": "somyacodes07",
  "name": "Somyajeet",
  "commandTitle": "somya@overworld ~ % ./profile.sh --live",
  "role": "AI/ML Engineer · Full Stack",
  "education": "CSE (AIML)",
  "status": "Building · Learning · Shipping",
  "avatar": {
    "auto": true,
    "url": "",
    "borderGlow": "#70C44A",
    "badgeText": "MINER // ONLINE"
  },
  "skills": {
    "ToolChain": "Hermes / Codex / Claude Code, Docker, Obsidian",
    "Core.Lang": "Python, Rust, JS, TS, Java, Kotlin",
    "Core.Frontend": "React, Next.js, Tailwind, Vite",
    "Core.Backend": "Node.js, FastAPI, Redis",
    "Core.Database": "PostgreSQL, MongoDB, Supabase",
    "Core.Infra": "Docker, GitHub Actions, Vercel"
  },
  "contacts": {
    "Portfolio": "somyacodes.in",
    "LinkedIn": "somyajeetsingh",
    "GitHub": "somyacodes07"
  },
  "heatmap": {
    "title": "OVERWORLD // SOMYACODES07"
  }
}
